{
  "schema_version": "0.3",
  "record_type": "migration_provenance",
  "record_id": "record:example:migration:001",
  "created_at": "2026-04-03T00:00:00Z",
  "migration_id": "migration:example:001",
  "target_topic_ref": "topic:example-migration",
  "source_inventory": [
    {
      "source_id": "source-example-001",
      "source_class": "historical_record",
      "source_ref": "source:example:migration:001",
      "captured_at": "2026-04-02T00:00:00Z"
    }
  ],
  "mappings": [
    {
      "source_id": "source-example-001",
      "target_object_ref": "knowledge:example-migration",
      "target_section": "Reusable conclusion",
      "decision": "copied",
      "reason": "The synthetic source maps to the example knowledge object."
    }
  ],
  "omitted_items": [],
  "source_unchanged": true,
  "source_unchanged_evidence_refs": ["evidence:example:readonly-copy"],
  "migration_state": "migrated",
  "runtime_validation_state": "pending_verification",
  "unresolved_conflicts": [],
  "relationships": {
    "target_main_ref": "knowledge:example-migration",
    "appendix_refs": [],
    "provenance_refs": ["knowledge:example-migration-provenance"],
    "evidence_refs": ["evidence:example:readonly-copy"],
    "supersedes": [],
    "superseded_by": []
  },
  "privacy": {"payload_handling": "synthetic_public", "sensitive_data_included": false},
  "authorization_effect": "none",
  "governance_effect": "none",
  "activation_state": "not_active"
}
